{
  "$schema": "https://json-schema.org/draft/2020-12/schema",
  "$id": "https://github.com/jihunni/Agentic-Drug-Discovery-System/blob/main/rl_env/specs/frontier_coupled_placebo_summary.schema.json",
  "title": "ADDS-Frontier payload-free coupled placebo readiness summary",
  "type": "object",
  "additionalProperties": false,
  "required": ["schema_version", "set_id", "protocol_id", "board_id", "status", "compiled_on", "public_coupled_augmentation_summary_integrity_sha256", "private_packet_set_commitment", "private_key_set_commitment", "design_rule", "triplet_packet_count", "canonical_arm_count", "candidate_reveal_arm_count", "placebo_reveal_arm_count", "candidate_exact_structural_delta_count", "placebo_exact_structural_delta_count", "candidate_placebo_structural_match_count", "whitespace_token_count_match_count", "placebo_vocabulary_policy_pass_count", "arm_role_balance_max_imbalance", "arm_role_balance_passed", "tokenizer_level_match_count", "reviewer_assignment_count", "reviewer_response_count", "candidate_coupling_label_count", "placebo_invariance_label_count", "contrast_label_count", "consensus_label_count", "three_arm_design_ready", "structural_confound_control_ready", "lexical_confound_control_ready", "human_semantic_review_required", "placebo_scientific_invariance_established", "candidate_scientific_coupling_established", "contrast_identifiability_established", "canonical_transition_coupling_coverage_ready", "oracle_revision_applied", "challenge_assignment_authorized", "expert_solve_gate_changed", "admission_gate_changed", "board_admitted_count", "baseline_model_runs_started", "benchmark_evidence_claimed", "private_payload_published", "nonclaims", "integrity_sha256"],
  "properties": {
    "schema_version": {"const": "adds.frontier-coupled-placebo-summary.v1"},
    "set_id": {"const": "adds-frontier-coupled-placebo-v1"},
    "protocol_id": {"const": "adds-frontier-v1"},
    "board_id": {"const": "adds-frontier-private-pilot-v1"},
    "status": {"const": "three_arm_placebo_packets_compiled_review_not_started"},
    "compiled_on": {"type": "string", "format": "date"},
    "public_coupled_augmentation_summary_integrity_sha256": {"$ref": "#/$defs/sha256"},
    "private_packet_set_commitment": {"$ref": "#/$defs/sha256"},
    "private_key_set_commitment": {"$ref": "#/$defs/sha256"},
    "design_rule": {"const": "blind_canonical_targeted_reveal_and_same_slot_content_null_reveal_with_equal_structural_delta_and_whitespace_token_count"},
    "triplet_packet_count": {"const": 10},
    "canonical_arm_count": {"const": 10},
    "candidate_reveal_arm_count": {"const": 10},
    "placebo_reveal_arm_count": {"const": 10},
    "candidate_exact_structural_delta_count": {"const": 10},
    "placebo_exact_structural_delta_count": {"const": 10},
    "candidate_placebo_structural_match_count": {"const": 10},
    "whitespace_token_count_match_count": {"const": 10},
    "placebo_vocabulary_policy_pass_count": {"const": 10},
    "arm_role_balance_max_imbalance": {"const": 1},
    "arm_role_balance_passed": {"const": true},
    "tokenizer_level_match_count": {"const": 0},
    "reviewer_assignment_count": {"const": 0},
    "reviewer_response_count": {"const": 0},
    "candidate_coupling_label_count": {"const": 0},
    "placebo_invariance_label_count": {"const": 0},
    "contrast_label_count": {"const": 0},
    "consensus_label_count": {"const": 0},
    "three_arm_design_ready": {"const": true},
    "structural_confound_control_ready": {"const": true},
    "lexical_confound_control_ready": {"const": false},
    "human_semantic_review_required": {"const": true},
    "placebo_scientific_invariance_established": {"const": false},
    "candidate_scientific_coupling_established": {"const": false},
    "contrast_identifiability_established": {"const": false},
    "canonical_transition_coupling_coverage_ready": {"type": "boolean"},
    "oracle_revision_applied": {"const": false},
    "challenge_assignment_authorized": {"const": false},
    "expert_solve_gate_changed": {"const": false},
    "admission_gate_changed": {"const": false},
    "board_admitted_count": {"const": 0},
    "baseline_model_runs_started": {"const": false},
    "benchmark_evidence_claimed": {"const": false},
    "private_payload_published": {"const": false},
    "nonclaims": {"type": "array", "minItems": 7, "uniqueItems": true, "items": {"type": "string", "minLength": 1}},
    "integrity_sha256": {"$ref": "#/$defs/sha256"}
  },
  "$defs": {"sha256": {"type": "string", "pattern": "^[0-9a-f]{64}$"}}
}
