{
  "admission_gate_changed": false,
  "arm_role_balance_max_imbalance": 1,
  "arm_role_balance_passed": true,
  "baseline_model_runs_started": false,
  "benchmark_evidence_claimed": false,
  "board_admitted_count": 0,
  "board_id": "adds-frontier-private-pilot-v1",
  "candidate_coupling_label_count": 0,
  "candidate_exact_structural_delta_count": 10,
  "candidate_placebo_structural_match_count": 10,
  "candidate_reveal_arm_count": 10,
  "candidate_scientific_coupling_established": false,
  "canonical_arm_count": 10,
  "canonical_transition_coupling_coverage_ready": false,
  "challenge_assignment_authorized": false,
  "compiled_on": "2026-08-23",
  "consensus_label_count": 0,
  "contrast_identifiability_established": false,
  "contrast_label_count": 0,
  "design_rule": "blind_canonical_targeted_reveal_and_same_slot_content_null_reveal_with_equal_structural_delta_and_whitespace_token_count",
  "expert_solve_gate_changed": false,
  "human_semantic_review_required": true,
  "integrity_sha256": "d4fbad84fad4c4c01656dfb330f04da3ee3f8d303d5d04cd14927a2759b101ea",
  "lexical_confound_control_ready": false,
  "nonclaims": [
    "Author-expected candidate changes and placebo intent are sealed selection metadata, not observations.",
    "No arm role, task, oracle, evidence text, identity, nonce, or reviewer payload is public.",
    "No oracle revision, challenge assignment, board admission, model run, or benchmark result is authorized.",
    "No reviewer was assigned and no coupling, invariance, contrast, consensus, or adjudication label exists.",
    "Structural matching does not establish that the placebo is scientifically irrelevant.",
    "Ten triplets are machine-compiled experiment drafts, not independently reviewed labels.",
    "Whitespace-token matching is not tokenizer, syntax, readability, or semantic matching."
  ],
  "oracle_revision_applied": false,
  "placebo_exact_structural_delta_count": 10,
  "placebo_invariance_label_count": 0,
  "placebo_reveal_arm_count": 10,
  "placebo_scientific_invariance_established": false,
  "placebo_vocabulary_policy_pass_count": 10,
  "private_key_set_commitment": "c8fadbc21a1d62903320ff9e6315cc6b2a330c80b7f242171a9e11b7d80435a0",
  "private_packet_set_commitment": "b35288dfca554fc2073c5a6a9f85fc28122d984cb8a42d7ce6ea574ed56b73a1",
  "private_payload_published": false,
  "protocol_id": "adds-frontier-v1",
  "public_coupled_augmentation_summary_integrity_sha256": "8e4b1e6f2574dd2eb45b50f4572b341bb9d68404478d30487bed5c8fc61aa501",
  "reviewer_assignment_count": 0,
  "reviewer_response_count": 0,
  "schema_version": "adds.frontier-coupled-placebo-summary.v1",
  "set_id": "adds-frontier-coupled-placebo-v1",
  "status": "three_arm_placebo_packets_compiled_review_not_started",
  "structural_confound_control_ready": true,
  "three_arm_design_ready": true,
  "tokenizer_level_match_count": 0,
  "triplet_packet_count": 10,
  "whitespace_token_count_match_count": 10
}
